Item Link,Title,New Price,Old Price,Availability
https://brickseek.com/walmart-inventory-checker/?sku=485160832,"Pen + Gear Ruled Index Cards, 3"" x 5"", 100 Count, White",$0.56,N/A,In Stock
https://brickseek.com/walmart-inventory-checker/?sku=36073419,"Chevron Delo 400 SDE 15W40 CK-4, 2.5 Gallon Jug",$33.97,N/A,In Stock
https://brickseek.com/walmart-inventory-checker/?sku=19897929,STP High Mileage Fuel Injector & Carburetor Treatment 2 Pack,$3.18,N/A,In Stock
https://brickseek.com/walmart-inventory-checker/?sku=777796220,"Ol' Roy Cuts in Gravy Wet Dog Food Variety Pack, Bacon Cheeseburger Flavor and Country Stew Flavor, 13.2 oz, 12 Pack",$6.97,N/A,In Stock
https://brickseek.com/walmart-inventory-checker/?sku=55317016,Interpet Heater Glass Life Thermal 50W for 3-10 Gallon Aquariums,$9.99,N/A,In Stock
https://brickseek.com/walmart-inventory-checker/?sku=24093553,"OUT! One Handed Dog Poop Scoop, Easy squeeze handle",$13.44,N/A,In Stock
https://brickseek.com/walmart-inventory-checker/?sku=492085581,Ready2Fish All-Species Just Add Bait Combo - Spinning,$17.76,N/A,In Stock
https://brickseek.com/walmart-inventory-checker/?sku=693623865,"Callaway Neon Golf Ball Markers, 8-Count",$2.97,N/A,In Stock
https://brickseek.com/walmart-inventory-checker/?sku=997683024,"SwissTech Wanderer 30-Inch Rolling Drop Bottom Duffel Bag with Telescopic Handle, Blue, 30.5""H x 16""W x 13.5""D",$20.00,N/A,In Stock
https://brickseek.com/walmart-inventory-checker/?sku=47302819,"Coghlan's 9"" Ultralight Aluminum Tent Stakes, Orange, Bulk",$0.96,N/A,In Stock
https://brickseek.com/walmart-inventory-checker/?sku=698316521,"Athletic Works Yoga Block 9 in. x 6 in. x 3 in. EVA Foam Charcoal Dark Gray Supportive and Lightweight for Yoga, Pilates, Meditation",$3.97,N/A,In Stock
https://brickseek.com/walmart-inventory-checker/?sku=34545699,"Over 'n Out! Advanced 6 Month Control Fire Ant Killer Granules, 11.5 Pounds",$19.55,$19.56,In Stock
https://brickseek.com/walmart-inventory-checker/?sku=737219523,"Mainstays Adjustable 8"" to 10"" Chrome Harp with Finial",$6.94,N/A,In Stock
https://brickseek.com/walmart-inventory-checker/?sku=47472023,"Duraflame Insta-match Multi-Purpose Utility Lighter, Large Fuel Tank, Colors May Vary",$1.98,N/A,In Stock
https://brickseek.com/walmart-inventory-checker/?sku=17127496,"Kendik Rubber Toilet Plunger with Wood Handle. Clears Toilets, Sinks, Drains.",$2.87,N/A,In Stock
https://brickseek.com/walmart-inventory-checker/?sku=45461603,"Clorox Zero Splash Bleach Packs, 12 ct",$3.46,N/A,In Stock
https://brickseek.com/walmart-inventory-checker/?sku=14711871,"Lysol Disinfectant Spray, Sanitizing and Antibacterial Spray, For Disinfecting and Deodorizing, Crisp Linen, 19 fl oz",$5.47,N/A,In Stock
https://brickseek.com/walmart-inventory-checker/?sku=41107428,"Favor Brilliant Shine Furniture Polish, Fresh Lemon, 9.7 Ounces",$1.88,N/A,In Stock
https://brickseek.com/walmart-inventory-checker/?sku=41172894,"Great Value Professional Strength Drain Clog Remover Gel, 80 Fluid Ounce",$3.88,N/A,In Stock
https://brickseek.com/walmart-inventory-checker/?sku=11027258,"Drano Max Gel Clog Remover, 32 oz",$3.68,N/A,In Stock
https://brickseek.com/walmart-inventory-checker/?sku=17474059,"Hyper Tough 2 in. Single Peg Hooks, Zinc Plated Steel (4 Pack)",$1.84,N/A,In Stock
https://brickseek.com/walmart-inventory-checker/?sku=49332865,Ozark Trail Clear Collapsible 5 Gallon Camping Water Storage,$8.97,N/A,In Stock
https://brickseek.com/walmart-inventory-checker/?sku=17474040,"Hyper Tough Screw-in Vinyl Coated Bicycle Hook, Red",$0.84,N/A,In Stock
https://brickseek.com/walmart-inventory-checker/?sku=34008332,"SentrySafe HD4100 Fire-Resistant and Water-Resistant Box Safe with Key Lock, 0.65 cu. ft.",$58.00,N/A,In Stock
https://brickseek.com/walmart-inventory-checker/?sku=17473962,"Bulldog Hardware 1 in. 17 Gauge Wire Nail, 2 oz. Pack",$1.08,N/A,In Stock
https://brickseek.com/walmart-inventory-checker/?sku=16539510,1/4 x 4 inch Slotted Screwdriver with Comfort Grip Handle TS60209Z,$0.97,N/A,In Stock
https://brickseek.com/walmart-inventory-checker/?sku=16927985,"Bondo Red Cream Hardener, Color Change During Mixing Ensures Consistency, 0.75 oz",$1.54,N/A,In Stock
https://brickseek.com/walmart-inventory-checker/?sku=17474042,"Hyper Tough Screw-in Vinyl Coated Garage Square Screw Hook, Red",$0.97,N/A,In Stock
https://brickseek.com/walmart-inventory-checker/?sku=168232956,Hyper Tough 2-Piece Adjustable Wrench Set,$6.72,N/A,In Stock
https://brickseek.com/walmart-inventory-checker/?sku=17474348,"Bulldog Hardware Closet Pole Socket Set, White Plastic (1 Set)",$0.97,N/A,In Stock
https://brickseek.com/walmart-inventory-checker/?sku=888709145,"First Aid Only 118-Piece First Aid Kit, OSHA Compliant",$20.94,N/A,In Stock
https://brickseek.com/walmart-inventory-checker/?sku=55283685,"Deflecto Magnetic Vent Cover, in White, Reusable, MVCX512/12",$3.97,N/A,In Stock
https://brickseek.com/walmart-inventory-checker/?sku=552980647,Hyper Tough Black Locking and Stacking Utility Box,$4.94,N/A,In Stock
https://brickseek.com/walmart-inventory-checker/?sku=48003203,"Bulldog Hardware Nail, Tack and Brad Value Kit Assortment, 200 Pack",$2.22,N/A,In Stock
https://brickseek.com/walmart-inventory-checker/?sku=106550327,HART 8 Gallon 6.0 Peak HP Stainless Steel Wet/Dry Vacuum,$76.00,N/A,In Stock
https://brickseek.com/walmart-inventory-checker/?sku=409158657,"Krylon Rust Protector Enamel Spray Paint, Satin, Black, 15 oz.",$4.30,N/A,In Stock
https://brickseek.com/walmart-inventory-checker/?sku=17510803,"Duck Brand 1.88 in x 55 yd General Purpose Masking Tape, Beige",$3.12,N/A,In Stock
https://brickseek.com/walmart-inventory-checker/?sku=13925187,"Great Value Pure Maple Syrup, 12.5 fl oz",$6.17,N/A,In Stock
https://brickseek.com/walmart-inventory-checker/?sku=22257774,"Carrots, Tomatoes & Broccoli Snack Tray with Hidden Valley Ranch Dressing , 7 oz",$2.50,N/A,In Stock
https://brickseek.com/walmart-inventory-checker/?sku=44391058,"Hillshire Farm Smoked Sausage, 14 oz",$2.94,N/A,In Stock
https://brickseek.com/walmart-inventory-checker/?sku=10415878,"Great Value Cinnamon French Toast Sticks, 16 Oz, 20 Ct (Frozen)",$2.08,N/A,In Stock
https://brickseek.com/walmart-inventory-checker/?sku=199420070,"Freshness Guaranteed Mustard Potato Salad, 32 oz",$2.36,N/A,In Stock
https://brickseek.com/walmart-inventory-checker/?sku=11047612,"Great Value 9"" Pie Crusts, 15 oz, 2 Count",$1.56,N/A,In Stock
https://brickseek.com/walmart-inventory-checker/?sku=15544059,"Great Value Finely Shredded Fiesta Blend Cheese, 16 oz",$2.77,N/A,In Stock
https://brickseek.com/walmart-inventory-checker/?sku=10315930,"Great Value Sauerkraut, 14.5 Oz",$0.72,N/A,In Stock
https://brickseek.com/walmart-inventory-checker/?sku=10315300,"Great Value Bay Leaves, 0.12 oz",$1.23,N/A,In Stock
https://brickseek.com/walmart-inventory-checker/?sku=172196409,"Great Value Tomato Ketchup, 32 oz",$0.90,N/A,In Stock
https://brickseek.com/walmart-inventory-checker/?sku=10451313,"Grape Tomatoes, 10 oz",$1.98,N/A,In Stock
https://brickseek.com/walmart-inventory-checker/?sku=937060690,"Quaker Instant Grits, Cheddar Cheese, 22 packets",$3.17,N/A,In Stock
https://brickseek.com/walmart-inventory-checker/?sku=11047625,"Great Value Vanilla Flavored Ice Cream Sandwiches, 42 oz, 12 Count",$1.97,N/A,In Stock
https://brickseek.com/walmart-inventory-checker/?sku=10315444,"Great Value Large Pitted Black Olives, 6 oz",$1.08,N/A,In Stock
https://brickseek.com/walmart-inventory-checker/?sku=16677204,"YoCrunch Low Fat Vanilla with M&Ms Yogurt, 4 Oz. Cups, 4 Count",$2.36,N/A,In Stock
https://brickseek.com/walmart-inventory-checker/?sku=10315918,"Great Value Sugar Free Syrup, 24 fl Oz",$1.33,N/A,In Stock
https://brickseek.com/walmart-inventory-checker/?sku=14336391,"Great Value Half and Half, 64 fl oz",$3.12,N/A,In Stock
https://brickseek.com/walmart-inventory-checker/?sku=34632117,"Danimals Strawberry Explosion & SwinginÃ¢Â€Â™ Strawberry Banana Variety Pack Smoothies, 3.1 Oz. Bottles, 18 Count",$5.38,N/A,In Stock
https://brickseek.com/walmart-inventory-checker/?sku=51259447,"Great Value Chicken Nuggets, 32 oz (Frozen)",$3.60,N/A,In Stock
https://brickseek.com/walmart-inventory-checker/?sku=10291137,"Libby's Crispy Sauerkraut Jar, 32 Oz",$1.47,N/A,In Stock
https://brickseek.com/walmart-inventory-checker/?sku=10290749,"Bar S Franks Made with Chicken & Pork, 12 Oz.",$0.86,N/A,In Stock
https://brickseek.com/walmart-inventory-checker/?sku=14336389,"Great Value Fully Cooked Homestyle Meatballs, 32 oz",$4.98,N/A,In Stock
https://brickseek.com/walmart-inventory-checker/?sku=14711314,"Great Value Fully Cooked Italian Style Meatballs, 32 oz",$4.98,N/A,In Stock
https://brickseek.com/walmart-inventory-checker/?sku=10320937,"Nissin Teriyaki Beef Flavor Chow Mein Noodles, 4 oz",$0.63,N/A,In Stock
https://brickseek.com/walmart-inventory-checker/?sku=10308272,"Lea & Perrins The Original Worcestershire Sauce, 10 fl oz Bottle",$3.38,N/A,In Stock
https://brickseek.com/walmart-inventory-checker/?sku=13893733,"Marketside Organic Baby Spinach, 5 oz",$1.96,N/A,In Stock
https://brickseek.com/walmart-inventory-checker/?sku=15413608,Nestle Nestum Infant Cereal Wheat & Honey 10.5 Oz,$1.98,N/A,In Stock
https://brickseek.com/walmart-inventory-checker/?sku=44390955,"Tomatoes On The Vine, Per lb",$1.47,N/A,In Stock
https://brickseek.com/walmart-inventory-checker/?sku=10533864,"Great Value Flaky & Buttery Crescent Rolls, 8 Count",$0.93,N/A,In Stock
https://brickseek.com/walmart-inventory-checker/?sku=44391031,"Hillshire Farm Polska Kielbasa Smoked Sausage, 14 oz",$2.94,N/A,In Stock
https://brickseek.com/walmart-inventory-checker/?sku=962886750,"Great Value Pretzel Sticks, 16 oz",$0.96,N/A,In Stock
https://brickseek.com/walmart-inventory-checker/?sku=49909688,"Cheetos Crunchy XXTRA Flamin' HotCheese Flavored Snacks, 8.5 oz Bag",$2.50,N/A,In Stock
https://brickseek.com/walmart-inventory-checker/?sku=10315952,"Great Value Honey Graham Crackers, 14.4 oz",$1.00,N/A,In Stock
https://brickseek.com/walmart-inventory-checker/?sku=51259208,"White Onions, each",$0.78,N/A,In Stock
https://brickseek.com/walmart-inventory-checker/?sku=12166443,"Danimals Strawberry Explosion Smoothies, 3.1 Oz. Bottles, 6 Count",$2.24,N/A,In Stock
https://brickseek.com/walmart-inventory-checker/?sku=585133649,"Great Value Pure Vanilla Extract, 4 fl oz",$7.28,N/A,In Stock
https://brickseek.com/walmart-inventory-checker/?sku=46491750,"Great Value Original Unsweetened Almond Milk, Half Gallon, 64 fl oz",$1.82,N/A,In Stock
https://brickseek.com/walmart-inventory-checker/?sku=10533323,"Great Value Tomato Ketchup, 64 oz",$1.60,N/A,In Stock
https://brickseek.com/walmart-inventory-checker/?sku=13893729,"Marketside Classic Iceberg Salad, 12 oz",$0.92,N/A,In Stock
https://brickseek.com/walmart-inventory-checker/?sku=364924551,"Great Value Concord Grape Jelly, 30 oz",$1.33,N/A,In Stock
https://brickseek.com/walmart-inventory-checker/?sku=400669492,"Great Value Cocktail Sauce, 12 fl oz",$0.98,N/A,In Stock
https://brickseek.com/walmart-inventory-checker/?sku=10450118,"Great Value Whole Vitamin D Milk, Half Gallon, 64 fl oz",$1.57,N/A,In Stock
https://brickseek.com/walmart-inventory-checker/?sku=22098472,"Quaker, Old Fashioned Grits, 24 oz, 1 Packet",$1.64,N/A,In Stock
https://brickseek.com/walmart-inventory-checker/?sku=16382445,"Great Value Buttermilk Pancakes, 33 Oz, 24 Ct (Frozen)",$2.68,N/A,In Stock
https://brickseek.com/walmart-inventory-checker/?sku=51258906,"StarKist Chunk Light Tuna in Water, 5 Oz, 4 Count",$3.28,N/A,In Stock
https://brickseek.com/walmart-inventory-checker/?sku=10315915,"Great Value Extra Virgin Olive Oil Non-Stick Cooking Spray, 7 oz",$1.92,N/A,In Stock
https://brickseek.com/walmart-inventory-checker/?sku=10313639,"Mezzetta Sliced Golden Greek Peperoncini, 16 fl oz",$1.80,N/A,In Stock
https://brickseek.com/walmart-inventory-checker/?sku=44391309,"Great Value Tomato Ketchup, 38 oz",$1.00,N/A,In Stock
https://brickseek.com/walmart-inventory-checker/?sku=378941019,"Great Value Hamburger Dill Chip Pickles, 32 fl oz",$1.43,N/A,In Stock
https://brickseek.com/walmart-inventory-checker/?sku=10292965,"DONA MARIA Traditional Mole, 8.25 oz",$1.74,N/A,In Stock
https://brickseek.com/walmart-inventory-checker/?sku=12166448,"Danimals Strawberry Explosion & Strikin’ Strawberry Kiwi Variety Pack Smoothies, 3.1 Oz. Bottles, 12 Count",$3.78,N/A,In Stock
https://brickseek.com/walmart-inventory-checker/?sku=10315479,"Great Value Creamy Peanut Butter, 40 ounces",$2.74,N/A,In Stock
https://brickseek.com/walmart-inventory-checker/?sku=42306176,"Great Value Semi-Sweet Chocolate Chips, 12 oz",$1.33,N/A,In Stock
https://brickseek.com/walmart-inventory-checker/?sku=37643096,"Quaker, Instant Grits Value Pack, Butter, 0.99 oz, 22 Packets",$3.17,N/A,In Stock
https://brickseek.com/walmart-inventory-checker/?sku=10312475,"Quaker, Quick 5-Minute Grits, 24 oz, 1 Packet",$1.68,N/A,In Stock
https://brickseek.com/walmart-inventory-checker/?sku=15754302,"Lender's Bagel Shop Blueberry Bagels, 17.1 oz, 6 Count",$1.52,N/A,In Stock
https://brickseek.com/walmart-inventory-checker/?sku=10534038,"Great Value Black Beans, 15.25 oz Can",$0.50,N/A,In Stock
https://brickseek.com/walmart-inventory-checker/?sku=36240078,"Marketside Organic Baby Spinach, 16 Oz",$3.66,N/A,In Stock
https://brickseek.com/walmart-inventory-checker/?sku=46695581,"Great Value Garlic Breadsticks,10.5 oz, 6 Ct (Frozen)",$1.64,N/A,In Stock
https://brickseek.com/walmart-inventory-checker/?sku=826201008,"POWERADE Fruit Punch Bottle, 28 fl oz",$0.88,N/A,In Stock
https://brickseek.com/walmart-inventory-checker/?sku=14651650,"Kraft Real Mayo Creamy & Smooth Mayonnaise, 30 fl oz Jar",$2.98,N/A,In Stock
https://brickseek.com/walmart-inventory-checker/?sku=10315486,"Great Value Baking Soda, 16 oz",$0.46,N/A,In Stock
https://brickseek.com/walmart-inventory-checker/?sku=10450339,"Great Value Ultra-Pasteurized Real Heavy Whipping Cream, 16 Oz",$1.60,N/A,In Stock
https://brickseek.com/walmart-inventory-checker/?sku=10534165,"Great Value Sweetened Condensed Milk, 14 oz",$1.12,N/A,In Stock
https://brickseek.com/walmart-inventory-checker/?sku=49909687,"Cheetos Crunchy Cheese Flavored Snacks, 8.5 oz Bag",$2.50,N/A,In Stock
https://brickseek.com/walmart-inventory-checker/?sku=10315443,"Great Value Medium Pitted Black Olives, 6 oz",$1.08,N/A,In Stock
https://brickseek.com/walmart-inventory-checker/?sku=36915845,"Cheetos Puff Cheese Flavored Snack, 8 oz",$2.50,N/A,In Stock
https://brickseek.com/walmart-inventory-checker/?sku=10291399,"Blue Bonnet Vegetable Oil Spread 4 Sticks, 16 oz",$0.84,N/A,In Stock
https://brickseek.com/walmart-inventory-checker/?sku=890488670,"Great Value Pretzel, Mini Twists, 16 oz",$0.96,N/A,In Stock
https://brickseek.com/walmart-inventory-checker/?sku=49909689,"Cheetos Crunchy Flamin' Hot Cheese Flavored Snacks, 8.5 oz Bag",$2.50,N/A,In Stock
https://brickseek.com/walmart-inventory-checker/?sku=17056888,"Great Value Mayonnaise, 30 Fl Oz Jar",$1.94,N/A,In Stock
https://brickseek.com/walmart-inventory-checker/?sku=48387973,StarKist® Chunk Light Tuna in Water - 5 oz Can (8-Pack),$6.48,N/A,In Stock
https://brickseek.com/walmart-inventory-checker/?sku=10532755,"Romaine Lettuce Hearts, 3 Pack",$2.60,N/A,In Stock
https://brickseek.com/walmart-inventory-checker/?sku=17209289,"Lender's Kosher Plain Bagels, 17.1 Oz, 6 Count",$1.52,N/A,In Stock
https://brickseek.com/walmart-inventory-checker/?sku=10415325,"Great Value 100% Apple Juice, 96 Fl. Oz.",$1.54,N/A,In Stock
https://brickseek.com/walmart-inventory-checker/?sku=39098615,"Great Value Chunk Chicken Breast, in Water, 12.5 oz, 2 Count Can",$3.32,N/A,In Stock
https://brickseek.com/walmart-inventory-checker/?sku=128642379,"Marketside Classic Hummus, 10 oz",$1.82,N/A,In Stock
https://brickseek.com/walmart-inventory-checker/?sku=10453076,"S&B Prepared Wasabi in Tube, 1.52 OZ",$1.64,N/A,In Stock
https://brickseek.com/walmart-inventory-checker/?sku=12444468,"Great Value Pizza Sauce, 14 oz",$1.00,N/A,In Stock
https://brickseek.com/walmart-inventory-checker/?sku=49914752,"Great Value Chunk Chicken Breast, 12.5 oz, 4 Count",$6.58,N/A,In Stock
https://brickseek.com/walmart-inventory-checker/?sku=10315447,"Great Value Sliced Black Olives, 2.25 oz",$0.67,N/A,In Stock
https://brickseek.com/walmart-inventory-checker/?sku=43711099,"Great Value Yellow Mustard, 20 oz Squeeze Bottle",$0.46,N/A,In Stock
https://brickseek.com/walmart-inventory-checker/?sku=105455228,"Marketside Roasted Garlic Hummus, 10 Oz",$1.82,N/A,In Stock
https://brickseek.com/walmart-inventory-checker/?sku=10450989,"Great Value Distilled White Vinegar, 64 fl oz",$1.36,N/A,In Stock
https://brickseek.com/walmart-inventory-checker/?sku=44390945,"Fresh, Green Bell Pepper, 1 Each",$0.60,N/A,In Stock
https://brickseek.com/walmart-inventory-checker/?sku=41592222,"Great Value Cream Cheese, 8 oz, 2 count",$1.57,N/A,In Stock
https://brickseek.com/walmart-inventory-checker/?sku=10450114,"Great Value Whole Vitamin D Milk, Gallon, 128 fl oz",$2.69,N/A,In Stock
https://brickseek.com/walmart-inventory-checker/?sku=44390948,"Bananas, each",$0.16,N/A,In Stock
https://brickseek.com/walmart-inventory-checker/?sku=10450340,"Great Value Ultra-Pasteurized Real Heavy Whipping Cream, 32 Oz",$3.12,N/A,In Stock
https://brickseek.com/walmart-inventory-checker/?sku=11046907,"Desitin Maximum Strength Baby Diaper Rash Cream with Zinc Oxide, 4 oz",$5.44,N/A,In Stock
https://brickseek.com/walmart-inventory-checker/?sku=477249040,"Wonder Nation Baby Boy & Toddler Boy Acid Wash Cargo Jeans, Sizes 12M-5T",$10.00,N/A,In Stock
https://brickseek.com/walmart-inventory-checker/?sku=48572005,"JASON Organic Smoothing Unrefined Coconut Oil, 15 fl. oz.",$5.28,N/A,In Stock
https://brickseek.com/walmart-inventory-checker/?sku=20682737,"Aunt Martha's 18"" x 24"" Days of the Week Hot Iron Transfers, 1 Each",$0.97,N/A,In Stock
https://brickseek.com/walmart-inventory-checker/?sku=446337753,"Flex Seal Mini Pool Patch and Repair Kit, Includes Flex Tape and Flex Glue, Clear",$7.88,N/A,In Stock
https://brickseek.com/walmart-inventory-checker/?sku=780360391,"Spa Selections Foam Out for Spas and Hot Tubs, Spa Chemicals, 16 oz",$4.83,N/A,In Stock
https://brickseek.com/walmart-inventory-checker/?sku=820214087,"Puzzle Guard Do & Glue, 8 Ounces",$5.00,N/A,In Stock
https://brickseek.com/walmart-inventory-checker/?sku=46239158,Fisher-Price Laugh & Learn Sis' Remote with Light-up Screen,$5.00,N/A,In Stock
https://brickseek.com/walmart-inventory-checker/?sku=46239159,Fisher-Price Laugh & Learn Puppy's Remote with Light-up Screen.,$5.00,N/A,In Stock
https://brickseek.com/walmart-inventory-checker/?sku=494778728,FurReal Walkalots Big Wags Unicorn Cat Toy - Interactive Pet,$10.00,N/A,In Stock
https://brickseek.com/walmart-inventory-checker/?sku=127461902,"Fisher-Price Baby's First Blocks with Storage Bucket, learn shapes and sort.",$5.00,N/A,In Stock
https://brickseek.com/walmart-inventory-checker/?sku=34718113,"Alka-Seltzer Plus Day & Night Multi-Symptom Cold & Flu, Liquid Gels, 20 Count",$4.98,N/A,In Stock
https://brickseek.com/walmart-inventory-checker/?sku=44395889,"Rolaids Advanced Antacid, Anti Gas Tablets (60 Ct, Mixed Berry)",$3.44,N/A,In Stock
https://brickseek.com/walmart-inventory-checker/?sku=10321567,"Smucker's Concord Grape Jelly, 18-Ounce",$2.34,N/A,In Stock
https://brickseek.com/walmart-inventory-checker/?sku=10532782,"TheraTears Lubricant Eye Drops For Dry Eyes, Dry Eye Therapy, 1 fl. Oz. Bottle",$10.54,N/A,In Stock
https://brickseek.com/walmart-inventory-checker/?sku=1413,"Flintstones Chewable Kids Vitamin, Multivitamin for Kids, 60 Count",$5.92,N/A,In Stock
https://brickseek.com/walmart-inventory-checker/?sku=10311443,"Flintstones Chewable Kid's Multivitamin w/ Immunity Support, 60 Ct",$5.98,N/A,In Stock
https://brickseek.com/walmart-inventory-checker/?sku=26384613,"Flintstones Gummies Kids Vitamin, Gummy Multivitamin for Kids, 180 Ct",$11.26,N/A,In Stock
https://brickseek.com/walmart-inventory-checker/?sku=36562758,"One A Day VitaCraves Teen for Her Multivitamin Gummies, 60 Count",$6.97,N/A,In Stock
https://brickseek.com/walmart-inventory-checker/?sku=10535292,"Grey Poupon Country Dijon Coarse Ground Mustard, 8 oz. Jar",$2.48,N/A,In Stock
https://brickseek.com/walmart-inventory-checker/?sku=173625240,"Flintstones Gummies Kids Multivitamin w/ Immunity Support, 150 Count",$11.26,N/A,In Stock
https://brickseek.com/walmart-inventory-checker/?sku=10324527,"Equate Fiber Therapy Methylcellulose Caplets, 500 mg, 100 Count",$7.62,N/A,In Stock
https://brickseek.com/walmart-inventory-checker/?sku=20608083,"Equate NiteTime Cold & Flu Multi-Symptom Relief, 24 Count",$2.67,N/A,In Stock
https://brickseek.com/walmart-inventory-checker/?sku=22388730,"Maximum Strength Mucinex Sinus-Max Severe Congestion & Pain, Sinus Symptom Relief, Pain Reliever, Expectorant and Nasal Decongestant, 20 Caplets",$10.46,N/A,In Stock
https://brickseek.com/walmart-inventory-checker/?sku=10294261,Excedrin Extra Strength Caplets – Headache Relief – 100 Count,$9.63,N/A,In Stock
https://brickseek.com/walmart-inventory-checker/?sku=516753286,"Flintstones Gummies Plus Immunity Support Children's Multivitamin, 60 Count",$5.98,N/A,In Stock
https://brickseek.com/walmart-inventory-checker/?sku=905653914,"Flintstones Chewable Kids Vitamins w Iron, Multivitamin for Kids, 60Ct",$5.92,N/A,In Stock
https://brickseek.com/walmart-inventory-checker/?sku=47064552,"Equate Low Dose Chewable Aspirin 81 mg Tablets, Cherry Flavor, Pain Reliever, For Adults, 36 Count, 3 Pack",$1.98,N/A,In Stock
https://brickseek.com/walmart-inventory-checker/?sku=36168192,"Nature Made Super B-Complex Supplement Tablets, 160 Count",$6.88,N/A,In Stock
https://brickseek.com/walmart-inventory-checker/?sku=10449312,"Smucker's Concord Grape Jelly, 32-Ounce",$2.36,N/A,In Stock
https://brickseek.com/walmart-inventory-checker/?sku=571480286,Equate Eq Allergy Fexofenadine Hcl 2x30 count,$9.92,N/A,In Stock
https://brickseek.com/walmart-inventory-checker/?sku=191193830,"Equate Absorbent Stretch Rolled Gauze, Value Pack, 5 Count",$4.82,N/A,In Stock
https://brickseek.com/walmart-inventory-checker/?sku=17056909,"Equate Extra Strength Cool & Heat Medicated Patch, 5 Count",$3.38,N/A,In Stock
https://brickseek.com/walmart-inventory-checker/?sku=205686017,Pressman Toys - Shark Bite Game,$10.00,N/A,In Stock
https://brickseek.com/walmart-inventory-checker/?sku=10308154,"Smucker's Squeeze Strawberry Fruit Spread, 20-Ounce",$2.54,N/A,In Stock
https://brickseek.com/walmart-inventory-checker/?sku=14940735,"Smucker's Seedless Red Raspberry Jam, 18-Ounce",$2.66,N/A,In Stock
https://brickseek.com/walmart-inventory-checker/?sku=425488211,"Equate No Drip Severe Congestion Nasal Pump Mist Value Size, 1 fl oz",$3.32,N/A,In Stock
https://brickseek.com/walmart-inventory-checker/?sku=334960573,"Malt-O-Meal Fruity Dyno Bites with Marshmallows, Gluteen Free, 35 oz",$5.23,N/A,In Stock
https://brickseek.com/walmart-inventory-checker/?sku=752365927,"Arm & Hammer Clean Scentsations In-Wash Scent Booster - Clean Meadow, 24 oz",$4.28,N/A,In Stock
https://brickseek.com/walmart-inventory-checker/?sku=10315375,"Great Value Original Saltine Crackers, 16 oz, 4 Count",$0.78,N/A,In Stock
https://brickseek.com/walmart-inventory-checker/?sku=14699300,Goliath Games - Pop the Pig Game,$10.00,N/A,In Stock
https://brickseek.com/walmart-inventory-checker/?sku=47375932,"Great Value Creamy Peanut Butter, 64 oz",$4.34,N/A,In Stock
https://brickseek.com/walmart-inventory-checker/?sku=17324929,"Coricidin HBP, Cold & Flu Relief Tablets, High Blood Pressure, 20 Count",$5.66,N/A,In Stock
https://brickseek.com/walmart-inventory-checker/?sku=14122821,"Equate Polyethylene Glycol 3350 Unflavored Powder for Solution, 30 Doses",$9.24,N/A,In Stock
https://brickseek.com/walmart-inventory-checker/?sku=665614784,Goliath Rattlesnake Jake - Get The Gold before He Strikes! Board Game,$10.00,N/A,In Stock
https://brickseek.com/walmart-inventory-checker/?sku=411224008,"Mainstays Indoor Battery-Operated 50-Count Wire Lights, with Multi-Color LED Lights, 8 Lighting Modes, 4.5 Volts",$3.97,N/A,In Stock
https://brickseek.com/walmart-inventory-checker/?sku=222773503,"Mainstays Battery-Operated Indoor 50-Count LED Warm White Wire Lights, with 8 Lighting Modes, 4.5 Volts",$3.97,N/A,In Stock
https://brickseek.com/walmart-inventory-checker/?sku=474382688,Hyper Tough 3-Pack Polarized Plug to Grounded White Indoor Plastic Adapter,$1.98,N/A,In Stock
https://brickseek.com/walmart-inventory-checker/?sku=617871861,Expert Gardener 24-inch Wood & Poly Leaf Rake,$8.50,N/A,In Stock
https://brickseek.com/walmart-inventory-checker/?sku=887151435,Expert Gardener 30-inch Wood & Poly Leaf Rake,$11.18,N/A,In Stock
https://brickseek.com/walmart-inventory-checker/?sku=19757709,"Enoz Fly Swatter, Wire Handled Plastic Fly Swatter, Assorted Colors, 2 Ct",$1.00,N/A,In Stock
https://brickseek.com/walmart-inventory-checker/?sku=17203827,Hyper Tough 32 Gallon Injection Molded Trash Can - Black - TI0044,$11.27,N/A,In Stock
https://brickseek.com/walmart-inventory-checker/?sku=139557619,"Expert Grill Instant Charcoal Briquets, 12 Lb",$6.97,N/A,In Stock
https://brickseek.com/walmart-inventory-checker/?sku=349998326,HART 20-Volt 10-inch String Trimmer/Bazooka Blower Combo Kit (1) 2.0Ah battery,$101.00,N/A,In Stock
https://brickseek.com/walmart-inventory-checker/?sku=16888910,"AcuRite 6"" White Analog Thermometer for Indoor Outdoor Use with Suction Cup 1.6"" x 7.4""",$0.97,N/A,In Stock
https://brickseek.com/walmart-inventory-checker/?sku=498222242,"Eliminator Wasp and Hornet Killer3, 17 Ounce, 3 Pack",$5.00,N/A,In Stock
https://brickseek.com/walmart-inventory-checker/?sku=575252759,"Expert Grill 14.5'' Portable Charcoal Grill, Black",$14.97,N/A,In Stock
https://brickseek.com/walmart-inventory-checker/?sku=16349546,"Mainstays White Swivel Suit Plastic Hanger for Any Clothing Type, 3 Count",$4.86,N/A,In Stock
