Item Link,Title,New Price,Old Price,Availability
https://brickseek.com/walmart-inventory-checker/?sku=132343186,Woodwick Wax Melt 3 Oz. - Vanilla Bean,$2.10,N/A,In Stock
https://brickseek.com/walmart-inventory-checker/?sku=35091844,The Lord of the Rings: Theatrical Versions: 3-Film Collection (Blu-ray),$5.96,N/A,In Stock
https://brickseek.com/walmart-inventory-checker/?sku=867197599,"Zebra Pen Mildliner, double-ended highlighter set, 15-pack",$14.64,$16.98,In Stock
https://brickseek.com/walmart-inventory-checker/?sku=49866859,"Great Value Dust Broom & Pan, Red",$4.53,$5.48,In Stock
https://brickseek.com/walmart-inventory-checker/?sku=550487623,Realtree Edge Camo Duck Tape Brand 1.88 in x 15 yd Duct Tape,$3.88,$4.97,In Stock
https://brickseek.com/walmart-inventory-checker/?sku=391835195,SNAX THE SLOTH,$15.00,$20.92,In Stock
https://brickseek.com/walmart-inventory-checker/?sku=16618684,"Coca-Cola Original Soda Pop, 2 Liter Bottle",$1.48,$1.74,In Stock
https://brickseek.com/walmart-inventory-checker/?sku=44391528,"Daily's Strawberry Daiquiri Pouch Frozen Cocktail, 10 fl oz",$1.98,N/A,In Stock
https://brickseek.com/walmart-inventory-checker/?sku=700580926,Wonder Nation Panda Bear Backpack with Lunch Bag,$9.00,N/A,In Stock
https://brickseek.com/walmart-inventory-checker/?sku=650286015,MVL X MEN LEGENDS AST,$6.86,N/A,In Stock
https://brickseek.com/walmart-inventory-checker/?sku=278659300,"Curver Tondo 11 Gallon Plastic Step Trash Can, Stainless Steel Look Wastebasket",$17.16,$25.24,Limited Stock
https://brickseek.com/walmart-inventory-checker/?sku=474382688,Hyper Tough 3-Pack Polarized Plug to Grounded White Indoor Plastic Adapter,$1.98,N/A,Limited Stock
https://brickseek.com/walmart-inventory-checker/?sku=646649427,LEGO Star Wars AT-ST Raider 75254 Building Set (540 Pieces),$30.00,$40.00,In Stock
https://brickseek.com/walmart-inventory-checker/?sku=871365428,As Seen On Tv True Touch 2 Sided Deshedding Glove For Pet Hair,$11.00,N/A,In Stock
https://brickseek.com/walmart-inventory-checker/?sku=946303615,"Gi Joe Operation Blackout, GameMill, Nintendo Switch, 856131008176",$17.93,$19.93,In Stock
https://brickseek.com/walmart-inventory-checker/?sku=553395115,George Crewneck Mens Short Sleeve T-Shirt,$1.00,N/A,Limited Stock
https://brickseek.com/walmart-inventory-checker/?sku=525862109,"LEGO Harry Potter Hogwarts Astronomy Tower 75969 Cool Kids' Magic Castle Gift, Building Toy with Minifigures (971 Pieces)",$80.00,$99.95,In Stock
https://brickseek.com/walmart-inventory-checker/?sku=359971935,Avengers: Infinity War (Blu-ray),$7.96,$19.96,Limited Stock
https://brickseek.com/walmart-inventory-checker/?sku=499822624,"Super Street the Game, GS2 GAMES, PlayStation 4, Physical",$7.88,$9.88,In Stock
https://brickseek.com/walmart-inventory-checker/?sku=616127322,Arctic Air Tower Pure,$54.00,$69.92,In Stock
https://brickseek.com/walmart-inventory-checker/?sku=346668253,"PAC-MAN 12-IN-1 Legacy Edition, ARCADE 1UP",$248.00,$315.00,In Stock
https://brickseek.com/walmart-inventory-checker/?sku=665876299,Mainstays 14.2 Gallon/54 Liter Stainless Steel Semi Round Kitchen Garbage Can with Lid,$20.00,$29.00,In Stock
https://brickseek.com/walmart-inventory-checker/?sku=913948327,Yankee Candle Sugared Cinnamon Apple - Original Large Jar Scented Candle,$10.00,$16.88,In Stock
https://brickseek.com/walmart-inventory-checker/?sku=147369792,Yankee Candle Warm Luxe Cashmere - Original Large Jar Scented Candle,$10.00,$16.88,In Stock
https://brickseek.com/walmart-inventory-checker/?sku=248528865,"onn. 10.1"" Tablet, 32GB Storage, 2GB RAM, Android 11 Go, 2GHz Quad-Core Processor, LCD Display, Dual-band Wi-Fi",$79.00,$89.00,In Stock
https://brickseek.com/walmart-inventory-checker/?sku=10309829,"Dulcolax Laxative Suppositories (4 Ct) Fast, Reliable Relief",$3.94,N/A,In Stock
https://brickseek.com/walmart-inventory-checker/?sku=751844797,"KISS i-ENVY 3D Collection Extreme False Eyelashes, Style 40 - Intense Bold",$0.39,N/A,In Stock
https://brickseek.com/walmart-inventory-checker/?sku=108208974,Canon PIXMA MG2522 Wired All-in-One Color Inkjet Printer,$29.00,$34.88,In Stock
https://brickseek.com/walmart-inventory-checker/?sku=11047625,"Great Value Vanilla Flavored Ice Cream Sandwiches, 42 oz, 12 Count",$1.97,$2.56,In Stock
https://brickseek.com/walmart-inventory-checker/?sku=10452477,"Great Value Finely Shredded Sharp Cheddar Cheese, 16 oz",$2.77,N/A,In Stock
https://brickseek.com/walmart-inventory-checker/?sku=383646443,"Beef Choice Angus Petite Filet Mignon, 0.22 - 1.5 lb",$19.31,N/A,In Stock
https://brickseek.com/walmart-inventory-checker/?sku=21368021,"Great Value Pure Vanilla Extract, 1 fl oz",$2.31,$2.32,In Stock
https://brickseek.com/walmart-inventory-checker/?sku=600104275,Yankee Candle Vanilla Cupcake - Original Large Jar Scented Candle,$10.00,$16.88,In Stock
https://brickseek.com/walmart-inventory-checker/?sku=799616335,"Emeril Lagasse Air Fryer Elite Home, 5 Quarts - Stainless Steel",$30.00,$39.00,In Stock
https://brickseek.com/walmart-inventory-checker/?sku=10448590,"Great Value Graham 9"" Pie Crust, 6 oz",$0.93,N/A,In Stock
https://brickseek.com/walmart-inventory-checker/?sku=432520440,"Great Value Pecan Halves, 8 oz",$4.73,N/A,In Stock
https://brickseek.com/walmart-inventory-checker/?sku=12444636,"Equate Polyethylene Glycol 3350 Unflavored Powder for Solution, 8.3 Oz.",$4.32,N/A,In Stock
https://brickseek.com/walmart-inventory-checker/?sku=572895654,Yankee Candle Apple Pumpkin - Large 2-Wick Tumbler Candle,$8.00,N/A,In Stock
https://brickseek.com/walmart-inventory-checker/?sku=920341794,Fujifilm Instax Mini 7+ Camera Bundle - Light Pink,$48.00,N/A,In Stock
https://brickseek.com/walmart-inventory-checker/?sku=452310445,Yankee Candle Balsam & Cedar - Original Large Jar Scented Candle,$10.00,$16.88,In Stock
https://brickseek.com/walmart-inventory-checker/?sku=914991518,Yankee Candle Kitchen Spice - Original Large Jar Scented Candle,$10.00,$16.88,In Stock
https://brickseek.com/walmart-inventory-checker/?sku=14707408,"Stack-On GCB-8RTA Steel 8-Gun Ready to Assemble Security Cabinet, Black",$119.00,$165.00,Limited Stock
https://brickseek.com/walmart-inventory-checker/?sku=685836827,"Need for Speed Hot Pursuit Remastered, Electronic Arts, Xbox One",$16.93,$19.93,Limited Stock
https://brickseek.com/walmart-inventory-checker/?sku=411289637,"L.A. COLORS Glows Color Craze Nail Polish, Orange, 0.44 Fl. Oz.",$0.19,$1.98,In Stock
https://brickseek.com/walmart-inventory-checker/?sku=110866898,"Life is Strange: True Colors, Square Enix, PlayStation 4, [Physical], 662248925028",$39.82,$49.94,Limited Stock
https://brickseek.com/walmart-inventory-checker/?sku=382394597,Yankee Candle Pink Sands - Original Large Jar Scented Candle,$10.00,$16.88,In Stock
https://brickseek.com/walmart-inventory-checker/?sku=726721703,Yankee Candle Midsummer's Night - Original Large Jar Scented Candle,$10.00,$16.88,In Stock
https://brickseek.com/walmart-inventory-checker/?sku=673176535,"Pilot G2 Retractable Gel Pens, Extra Fine Pt, Black Ink, 5 Pk, 673176535",$1.80,$5.62,In Stock
https://brickseek.com/walmart-inventory-checker/?sku=901976281,"Kent 26 In. Seachange Women's Bike, Blue",$128.00,$168.00,In Stock
https://brickseek.com/walmart-inventory-checker/?sku=108900976,"Mainstays Battery-Operated Indoor 20-Count LED Mini Photo Clip Lights, with Built-in Timer, 4.5 Volts",$4.97,N/A,In Stock
https://brickseek.com/walmart-inventory-checker/?sku=346659890,"eos Super Soft Shea Lip Balm Stick & Sphere - Pineapple Passionfruit and Coconut Milk , Moisuturzing Shea Butter for Chapped Lips , 0.39 oz, 2 count",$4.96,N/A,In Stock
https://brickseek.com/walmart-inventory-checker/?sku=540112739,KitchenAid 7 Cup Food Processor - KFP0710,$64.00,N/A,In Stock
https://brickseek.com/walmart-inventory-checker/?sku=708633470,Zack Snyder's Justice League (DVD),$7.96,$17.96,In Stock
https://brickseek.com/walmart-inventory-checker/?sku=470959377,imPRESS Halloween Press-on Manicure Nails - Haunted,$0.69,N/A,Limited Stock
https://brickseek.com/walmart-inventory-checker/?sku=739276537,Finding Nemo / Finding Dory: 2-Movie Collection (DVD),$12.96,N/A,In Stock
https://brickseek.com/walmart-inventory-checker/?sku=49967011,The Daniel Craig Collection (DVD),$5.96,$12.96,In Stock
https://brickseek.com/walmart-inventory-checker/?sku=17235796,"Mucinex Fast-Max Maximum Strength Severe Congestion & Cough, Multi-Symptom Relief, Cough Suppressant, Expectorant, Nasal Decongestant, 6 FL OZ",$10.46,N/A,In Stock
https://brickseek.com/walmart-inventory-checker/?sku=413674229,Zack Snyder's Justice League (Blu-ray),$9.96,N/A,In Stock
https://brickseek.com/walmart-inventory-checker/?sku=460113736,Star Wars: Episode VI: Return of the Jedi (Blu-ray),$7.96,N/A,Limited Stock
https://brickseek.com/walmart-inventory-checker/?sku=285812150,"Mainstays 4 Cube TV Console for TVs Up to 59"", True Black Oak",$30.00,$79.00,In Stock
https://brickseek.com/walmart-inventory-checker/?sku=327621569,"onn. 8"" Kids Tablet, Pink, 32GB Storage, 2GB RAM, Android 11 Go, 2GHz Quad-Core Processor, LCD Display, Dual-band Wi-Fi",$59.00,N/A,In Stock
https://brickseek.com/walmart-inventory-checker/?sku=273074454,"onn. 8"" Kids Tablet, Blue, 32GB Storage, 2GB RAM, Android 11 Go, 2GHz Quad-Core Processor, LCD Display, Dual-band Wi-Fi",$59.00,N/A,In Stock
https://brickseek.com/walmart-inventory-checker/?sku=457297150,"Shark Pro Swivel Pet Upright Vacuum with Self-cleaning Brushroll, CU50WM",$99.00,N/A,In Stock
https://brickseek.com/walmart-inventory-checker/?sku=10452768,"L'Oreal Paris Studio Line Clean Strong Hold Hair Gel, 6.8 oz",$3.46,N/A,In Stock
https://brickseek.com/walmart-inventory-checker/?sku=172196409,"Great Value Tomato Ketchup, 32 oz",$0.90,N/A,In Stock
https://brickseek.com/walmart-inventory-checker/?sku=576710187,"Shark EZ Robot Vacuum with Self-Empty Base, Bagless, Works with Google Assistant, White (RV913S)",$288.00,N/A,In Stock
https://brickseek.com/walmart-inventory-checker/?sku=979395096,Zack Snyder's Justice League (4K Ultra HD + Blu-ray),$9.96,$29.96,In Stock
https://brickseek.com/walmart-inventory-checker/?sku=218018958,"Barbie Dreamhouse (3.75-Ft) Dollhouse W Ith Pool, Slide, Elevator, Lights & Sounds, New For 2021",$179.00,$199.00,In Stock
https://brickseek.com/walmart-inventory-checker/?sku=189673221,Guardians of the Galaxy (Blu-ray),$7.96,N/A,In Stock
https://brickseek.com/walmart-inventory-checker/?sku=588131663,"Skullcandy Jib True XT 2 True Wireless Earbuds, Bluetooth v5.2, 33 Hours of Battery, Tile™, IPX4 Water Resistance, Black",$19.00,N/A,In Stock
https://brickseek.com/walmart-inventory-checker/?sku=164329959,NETGEAR Nighthawk Dual-Band WiFi 6 AX1500 Mesh System 1.5 Gbps Router + 2 Satellites (MK6W-100NAS),$149.00,$249.00,In Stock
https://brickseek.com/walmart-inventory-checker/?sku=837296761,"Thyme & Table Wood Board & Silicone Baking Set, 20-Pieces",$30.00,N/A,In Stock
https://brickseek.com/walmart-inventory-checker/?sku=806285278,"Arlo Essential Spotlight Wireless Security Camera - 3 Pack - 1080p Video Color Night Vision, White VMC2330W",$199.00,$349.00,In Stock
https://brickseek.com/walmart-inventory-checker/?sku=936481722,"Shark® Pet Plus Cordless Stick Vacuum with Self Cleaning Brushroll and PowerFins Technology, WZ140",$159.00,N/A,In Stock
https://brickseek.com/walmart-inventory-checker/?sku=567888022,Fujifilm Instax Mini 7+ Camera Bundle- Light Blue,$48.00,$69.00,In Stock
https://brickseek.com/walmart-inventory-checker/?sku=919035034,Mandalorian Boys Underwear. 5 Pack Briefs (Little Boys & Big Boys),$5.50,N/A,In Stock
https://brickseek.com/walmart-inventory-checker/?sku=165267166,"Eclipse Kenley Solid Color Blackout Rod Pocket Single Curtain Panel, Espresso Brown, 52 x 84",$8.00,N/A,Limited Stock
https://brickseek.com/walmart-inventory-checker/?sku=567888022,Fujifilm Instax Mini 7+ Camera Bundle- Light Blue,$48.00,$69.00,In Stock
https://brickseek.com/walmart-inventory-checker/?sku=387794631,"BrellaShade Pop Up Windshield Umbrella by Sharper Image - Blocks UV Rays, Keeps Cars Cooler & Protects Car Interior",$11.00,N/A,In Stock
https://brickseek.com/walmart-inventory-checker/?sku=714442446,"Better Homes and Gardens 5/8"" Diameter Satin Nickel Add-on Rod, 44 - 120"" Expandable Width",$2.49,N/A,In Stock
https://brickseek.com/walmart-inventory-checker/?sku=212621166,"Raptic Shield for Samsung A51, Iridescent",$5.00,N/A,Limited Stock
https://brickseek.com/walmart-inventory-checker/?sku=932837601,Disney Stitch Pineapple Floral All over Print Backpack,$2.00,N/A,Limited Stock
https://brickseek.com/walmart-inventory-checker/?sku=16561393,"V.I.P. GE Receptacle with Safety Shutters Outlet, White",$4.14,N/A,In Stock
https://brickseek.com/walmart-inventory-checker/?sku=23591051,"Arrid XX Extra Extra Dry Solid Antiperspirant Deodorant, Ultra Fresh, 2.6 oz.",$1.36,N/A,In Stock
https://brickseek.com/walmart-inventory-checker/?sku=664383229,"Pen+Gear Magnetic Dry Erase Board, Black, 17"" x 23""",$4.00,N/A,In Stock
https://brickseek.com/walmart-inventory-checker/?sku=44662573,"Great Value Ground Black Pepper, 3 oz",$2.36,N/A,In Stock
https://brickseek.com/walmart-inventory-checker/?sku=17619799,"Celestial Seasonings Sleepytime Sinus Soother Herbal Wellness Tea, 20 Ct Tea Bags",$2.80,N/A,In Stock
https://brickseek.com/walmart-inventory-checker/?sku=185158834,"Atkins Gluten Free Protein-Rich Shake, Chocolate Banana, Keto Friendly, 4 Count",$4.98,N/A,In Stock
https://brickseek.com/walmart-inventory-checker/?sku=322449320,"Way to Celebrate Halloween Family Pajamas Women's and Women's Plus, Women's 2 Piece set",$1.00,N/A,Limited Stock
https://brickseek.com/walmart-inventory-checker/?sku=594095888,"Whalen Xavier 3-in-1 TV Stand for TVs up to 70"", with 3 Display Options for Flat Screens, Black with Silver Accents",$139.00,N/A,In Stock
https://brickseek.com/walmart-inventory-checker/?sku=976037372,"Mainstays, Shaped Pumpkin Decorative Pillow, 7.5"" x 11.5"", Ivory, 1 Piece",$1.29,N/A,In Stock
https://brickseek.com/walmart-inventory-checker/?sku=14264848,"Equate soft dual action power toothbrush for deep cleaning, 1 count",$2.10,N/A,In Stock
https://brickseek.com/walmart-inventory-checker/?sku=750346485,"Frozen Girls 4-8 Panties, 7 Pack",$5.50,N/A,In Stock
https://brickseek.com/walmart-inventory-checker/?sku=10315918,"Great Value Sugar Free Syrup, 24 fl Oz",$1.33,N/A,In Stock
https://brickseek.com/walmart-inventory-checker/?sku=793359026,onn. Wireless Charging Pad with LED Night Light,$5.00,N/A,In Stock
https://brickseek.com/walmart-inventory-checker/?sku=666447980,"Wilson A500 11.5"" Infield Baseball Glove, Right-hand Throw",$40.00,N/A,In Stock
https://brickseek.com/walmart-inventory-checker/?sku=592294472,"Alba Botanica Very Emollient Honey Mango Bath & Shower Gel, 12 Oz.",$2.10,$6.99,In Stock
https://brickseek.com/walmart-inventory-checker/?sku=799616335,"Emeril Lagasse Air Fryer Elite Home, 5 Quarts - Stainless Steel",$39.00,N/A,In Stock
https://brickseek.com/walmart-inventory-checker/?sku=51259038,"Beef Choice Angus Ribeye Steak Thin, 0.43 - 1.68 lb",$17.07,N/A,In Stock
https://brickseek.com/walmart-inventory-checker/?sku=24099773,"Hanes Women's Cool Comfort Crew Socks, 10-Pair Value Pack",$7.00,N/A,In Stock
https://brickseek.com/walmart-inventory-checker/?sku=44390944,"Roma Tomatoes, each",$0.29,N/A,In Stock
https://brickseek.com/walmart-inventory-checker/?sku=115950368,"Merkury Innovations Smart Symphony RGBW Strip Lights, 16ft, Sound-Sync",$18.88,N/A,In Stock
https://brickseek.com/walmart-inventory-checker/?sku=421506949,"Sky Organics Cruelty-Free 100% Biodegradable Cotton Rounds, 100 ct.",$2.48,N/A,In Stock
https://brickseek.com/walmart-inventory-checker/?sku=46008054,"Red Cross Toothache Medication, 0.125 fl oz Bottle",$4.96,N/A,In Stock
https://brickseek.com/walmart-inventory-checker/?sku=407622081,"Paw Patrol Toddler Girls Sleep Pajamas, 2-Piece, Sizes 2T-5T",$1.00,N/A,In Stock
https://brickseek.com/walmart-inventory-checker/?sku=601384092,"Minnie Girls' 4-6 Dots Panties, 7 Pack",$5.50,N/A,Limited Stock
https://brickseek.com/walmart-inventory-checker/?sku=48572005,"JASON Organic Smoothing Unrefined Coconut Oil, 15 fl. oz.",$5.28,N/A,In Stock
https://brickseek.com/walmart-inventory-checker/?sku=918374372,STANLEY 6 Piece Stainless Steel Camping Mess Kits,$11.00,N/A,In Stock
https://brickseek.com/walmart-inventory-checker/?sku=520191741,"SHARPER IMAGE Thunder Tumbler Toy RC Car for Kids, Remote Control Monster Spinning Stunt Mini Truck for Girls and Boys, Racing Flips and Tricks with 5th Wheel, 27 MHz Blue",$9.97,N/A,Limited Stock
https://brickseek.com/walmart-inventory-checker/?sku=704214651,"L.O.L. Surprise! Girls' 4-8 Panties, 7 Pack",$5.50,N/A,In Stock
https://brickseek.com/walmart-inventory-checker/?sku=43711099,"Great Value Yellow Mustard, 20 oz Squeeze Bottle",$0.46,N/A,In Stock
https://brickseek.com/walmart-inventory-checker/?sku=934955207,"Little Live Pets - Sparkle Pets Boutique | Interactive Toy Pets Including a Light Up Bird, Fish in Tank, Mum & Baby Turtles. For Kids Ages 4+",$29.00,$34.00,In Stock
https://brickseek.com/walmart-inventory-checker/?sku=34541159,"Duck Professional Rubber Electrical Tape, 0.75 in. x 66 ft., Black",$2.42,N/A,In Stock
https://brickseek.com/walmart-inventory-checker/?sku=801463563,Yankee Candle Salted Caramel - Original Large Jar Scented Candle,$10.00,N/A,In Stock
https://brickseek.com/walmart-inventory-checker/?sku=821482000,Hyper Tough 6 Outlet 6ft Surge 900-Joule Protection with Glossy Black,$10.54,$12.38,In Stock
https://brickseek.com/walmart-inventory-checker/?sku=347050908,Hyper Tough 6 Outlet 6ft Surge 900-Joule Protection with Glossy White,$10.54,$12.38,In Stock
https://brickseek.com/walmart-inventory-checker/?sku=657129800,Tim Burton's the Nightmare Before Christmas [With Audio CD] (Paperback),$0.62,N/A,In Stock
https://brickseek.com/walmart-inventory-checker/?sku=4404150,Goodyear Wrangler Radial All-Season P235/75R15 105S Tire,$61.00,$74.00,In Stock
https://brickseek.com/walmart-inventory-checker/?sku=175560877,Star Wars: Squadrons - Xbox One,$16.93,$19.93,In Stock
https://brickseek.com/walmart-inventory-checker/?sku=920952665,"Hanes Men's Stretch White Crew T-Shirt Undershirts, 3 Pack",$5.00,$13.98,In Stock
https://brickseek.com/walmart-inventory-checker/?sku=34581895,"Hanes Women's Cool Comfort No Show Socks, 10-Pair Value Pack",$7.00,N/A,In Stock
https://brickseek.com/walmart-inventory-checker/?sku=20682737,"Aunt Martha's 18"" x 24"" Days of the Week Hot Iron Transfers, 1 Each",$0.97,N/A,In Stock
https://brickseek.com/walmart-inventory-checker/?sku=329102320,As Seen On Tv Vanity Planet Face And Body Ice Roller,$10.86,$14.88,Limited Stock
https://brickseek.com/walmart-inventory-checker/?sku=188399542,"b.tan Just Act Natural Self Tan Mousse, 6.7 fl oz",$2.69,N/A,In Stock
https://brickseek.com/walmart-inventory-checker/?sku=36618466,"Sara Lee Sweet Hawaiian Rolls, No High Fructose Corn Syrup, 12 Rolls, 15 Ounce Bag",$1.88,N/A,In Stock
https://brickseek.com/walmart-inventory-checker/?sku=49909691,"Cheetos Crunchy Flamin Hot Limon Cheese Snacks, 8.5 oz",$2.50,N/A,In Stock
https://brickseek.com/walmart-inventory-checker/?sku=10450116,"Great Value 1% Low Fat Milk, Gallon, 128 fl oz",$2.39,$2.68,In Stock
https://brickseek.com/walmart-inventory-checker/?sku=10294441,"Eight O'Clock The Original Medium Roast Whole Bean Coffee, 36 Oz, Bag",$10.66,$12.98,In Stock
https://brickseek.com/walmart-inventory-checker/?sku=10315481,"Great Value Butter Flavored Syrup, 24 fl oz",$1.33,N/A,In Stock
https://brickseek.com/walmart-inventory-checker/?sku=10450338,"Great Value Half & Half, 32 fl oz",$1.60,$2.24,In Stock
https://brickseek.com/walmart-inventory-checker/?sku=10450119,"Great Value 2% Reduced Fat Milk, Half Gallon, 64 fl oz",$1.48,$1.61,In Stock
https://brickseek.com/walmart-inventory-checker/?sku=13893738,"Marketside Fresh Spinach, 10 oz",$1.54,$2.28,In Stock
https://brickseek.com/walmart-inventory-checker/?sku=10452477,"Great Value Finely Shredded Sharp Cheddar Cheese, 16 oz",$2.77,$4.22,In Stock
https://brickseek.com/walmart-inventory-checker/?sku=17619683,"International Delight Caramel Macchiato Coffee Creamer, 32 fl oz",$2.64,N/A,In Stock
https://brickseek.com/walmart-inventory-checker/?sku=10449160,"PAM Original Cooking Spray, Canola Oil Nonstick Cooking & Baking Spray, 8 oz",$3.44,$3.78,In Stock
https://brickseek.com/walmart-inventory-checker/?sku=12335111,"Great Value All Natural Sour Cream, 16 oz Tub",$1.00,$1.74,In Stock
https://brickseek.com/walmart-inventory-checker/?sku=10452423,"Great Value Singles American Pasteurized Prepared Cheese Product, 24 count, 16 oz",$1.58,$3.48,In Stock
https://brickseek.com/walmart-inventory-checker/?sku=10450997,"Great Value Distilled White Vinegar, 32 fl oz",$0.70,$0.80,In Stock
https://brickseek.com/walmart-inventory-checker/?sku=764659276,"Great Value Fruit & Grain Bars, Variety Pack, 41.6 oz, 32 Count",$5.38,$6.96,In Stock
https://brickseek.com/walmart-inventory-checker/?sku=21905233,"Great Value Vanilla Wafers, 11oz",$1.34,$1.64,In Stock
https://brickseek.com/walmart-inventory-checker/?sku=44390944,"Roma Tomatoes, each",$0.28,$0.35,In Stock
https://brickseek.com/walmart-inventory-checker/?sku=569529368,"Aspercreme 4% Lidocaine (2.5 Oz), No Mess Applicator",$8.11,$8.12,In Stock
https://brickseek.com/walmart-inventory-checker/?sku=10416005,"Great Value 100% Juice Cranberry Blend, 64 fl oz",$2.27,$2.28,In Stock
https://brickseek.com/walmart-inventory-checker/?sku=596361614,"Protege Pilot Case 18"" Softside Carry-on Luggage, Black",$10.00,N/A,In Stock
https://brickseek.com/walmart-inventory-checker/?sku=297726908,"GiftPOP™ Holiday Popcorn Tin, Merry Christmas Design, Assorted Popcorn Flavors, 22 Ounces",$1.00,N/A,In Stock
https://brickseek.com/walmart-inventory-checker/?sku=715555373,Time and Tru Women's Puffer Coat with Hood,$5.00,N/A,Limited Stock
https://brickseek.com/walmart-inventory-checker/?sku=688177781,Cra-Z-Art Palmer Acrylic Paint Pouring Art Activity Kit - Rainbow Twist,$10.00,N/A,Limited Stock
https://brickseek.com/walmart-inventory-checker/?sku=319265700,Hyper Tough 20 Gallon Injection Molded Trash Can - Black - TI0057,$9.74,$11.98,In Stock
https://brickseek.com/walmart-inventory-checker/?sku=564989487,Hyper Tough 10FT 16AWG 3 Prong Black Outdoor Single Outlet Extension Cord,$6.73,$7.40,In Stock
https://brickseek.com/walmart-inventory-checker/?sku=34729731,"Gator Clamp-On Aluminum Oxide 1/4 Sandpaper Sheets, 100-Grit, 6-Pack, 5032-30",$1.47,N/A,In Stock
https://brickseek.com/walmart-inventory-checker/?sku=20551360,"Crystal Geyser Alpine Spring Water, 1 Gal",$1.00,N/A,In Stock
https://brickseek.com/walmart-inventory-checker/?sku=15718133,"Eight O'Clock 100% Colombian Peaks Medium Roast Whole Bean Coffee, 33 Oz, Bag",$10.66,N/A,In Stock
https://brickseek.com/walmart-inventory-checker/?sku=49909699,"Cheetos Crunchy Cheddar Jalapeno Cheese Snacks, 8.5 oz",$2.50,N/A,In Stock
https://brickseek.com/walmart-inventory-checker/?sku=10790822,"Fritos Original Flavor Bean Dip, 9 Oz.",$2.50,N/A,In Stock
https://brickseek.com/walmart-inventory-checker/?sku=10294604,"Cream of Wheat, Minute Hot Cereal, Original, 28 oz, 1 Packet",$3.32,N/A,In Stock
https://brickseek.com/walmart-inventory-checker/?sku=10534163,"Great Value Evaporated Milk, 12 Fl Oz",$0.67,N/A,In Stock
https://brickseek.com/walmart-inventory-checker/?sku=894532066,"Star Wars The Mandalorian The Child Baby Yoda Birthday Banner, 6ft",$1.97,N/A,In Stock
https://brickseek.com/walmart-inventory-checker/?sku=254850228,Eastsport Rail Tech Black Backpack,$4.50,N/A,In Stock
https://brickseek.com/walmart-inventory-checker/?sku=170478967,"e.l.f. Cosmetics Prime & Stay Finishing Powder, Sheer",$2.00,N/A,In Stock
https://brickseek.com/walmart-inventory-checker/?sku=638792015,Vanity Planet Outlines LED WAND EA,$17.00,$24.20,In Stock
https://brickseek.com/walmart-inventory-checker/?sku=461781221,Way To Celebrate Harvest Sunflowers & Leaves Floral Arrangement,$0.99,$2.49,Limited Stock
https://brickseek.com/walmart-inventory-checker/?sku=46239159,Fisher-Price Laugh & Learn Puppy's Remote with Light-up Screen.,$5.00,$7.88,In Stock
https://brickseek.com/walmart-inventory-checker/?sku=361660265,iPhone SE Leather Case - Black,$27.00,N/A,In Stock
https://brickseek.com/walmart-inventory-checker/?sku=450453067,Race With Ryan Road Trip Deluxe Edition,$19.93,N/A,In Stock
https://brickseek.com/walmart-inventory-checker/?sku=949588966,"Gorilla Dual Temp Mini Hot Glue Gun, 1 Each",$7.84,N/A,In Stock
https://brickseek.com/walmart-inventory-checker/?sku=46762575,SentrySafe Deluxe Cash Box,$24.64,N/A,In Stock
https://brickseek.com/walmart-inventory-checker/?sku=47934569,"Avery Insertable Style Edge Plastic Dividers, 5 Tabs (11200)",$3.72,N/A,In Stock
https://brickseek.com/walmart-inventory-checker/?sku=831936995,"UCreate Pacon 22"" x 28"" Heavy Coated Black Poster Board",$0.97,N/A,In Stock
https://brickseek.com/walmart-inventory-checker/?sku=720337649,"U Brands Magnetic Tile Dry Erase Whiteboard with Marker and Magnet, 14"" x 14"", Presentation Board, White, Frameless, 460U",$3.00,N/A,In Stock
https://brickseek.com/walmart-inventory-checker/?sku=125993428,"Sharpie Permanent Markers, Fine Point, Assorted Bold Colors, 12 Count",$9.00,N/A,In Stock
https://brickseek.com/walmart-inventory-checker/?sku=20882073,"Alliance 2654A, #54, (Assorted Sizes) Advantage Rubber Bands, 2 oz Bag of Assorted Colors",$0.72,N/A,In Stock
https://brickseek.com/walmart-inventory-checker/?sku=287693174,"Pen+Gear 5"" Blunt 2 Pack, Kids Scissors, Blue and Green, 153510-1004",$1.00,N/A,In Stock
https://brickseek.com/walmart-inventory-checker/?sku=47693361,"Deflecto Floor Register, 4 inches x 10 inches, in Brown, RGFB104",$3.97,$4.81,In Stock
https://brickseek.com/walmart-inventory-checker/?sku=20882070,"Size #32, (3"" x 1/8"") Advantage Rubber Bands 2632A, 2 oz Bag of Approx. 88 Bands, Natural",$0.72,N/A,In Stock
